{"canonical_revision":1,"comparison":{"mechanism":{"source_locator":null,"value":null},"theme":{"source_locator":"metadata.yaml#title","value":"選択の所有 — Owner of Choice（旧P0001復旧版）"}},"content_sha256":"9be82861e633dc2930a55ac33727886c3f4d4bb03e2b2179c336d6b3827e8716","contract_version":"catalog-lineage/v1","creator_id":"synthetic-provider-new-clone-creator","derived_from":[],"origin_instance_id":"synthetic-provider-new-clone-instance","record_id":"P0009","revision":1,"source_identity":"production/owner-of-choice#PL001","source_plans":[],"stage":"PLANNED","stage_evidence":[]}
