{"canonical_revision":1,"comparison":{"mechanism":{"source_locator":null,"value":null},"theme":{"source_locator":"metadata.yaml#title","value":"余白の呼吸 — Yohaku Breath"}},"content_sha256":"54658b11dbd1975cb367c7dd5b9cf502afb62dfb1a33e80071ce655a1a4fba5b","contract_version":"catalog-lineage/v1","creator_id":"synthetic-provider-new-clone-creator","derived_from":[],"origin_instance_id":"synthetic-provider-new-clone-instance","record_id":"P0003","revision":1,"source_identity":"production/yohaku-breath#PL001","source_plans":[],"stage":"PLANNED","stage_evidence":[]}
