{"canonical_revision":1,"comparison":{"mechanism":{"source_locator":null,"value":null},"theme":{"source_locator":"metadata.yaml#title","value":"外部化された憑依 — 停止条件によって切り落とされた運筆プロトコルと自律的余白"}},"content_sha256":"e09692d6d42821fa7ac1cccd9e387a0221aef531bb1a4a3f1767ba22a7f9206c","contract_version":"catalog-lineage/v1","creator_id":"synthetic-provider-new-clone-creator","derived_from":[],"origin_instance_id":"synthetic-provider-new-clone-instance","record_id":"P0009","revision":1,"source_identity":"production/external-possession-v1#PL001","source_plans":[],"stage":"PLANNED","stage_evidence":[]}
