{"canonical_revision":1,"comparison":{"mechanism":{"source_locator":null,"value":null},"theme":{"source_locator":"metadata.yaml#title","value":"Review threshold as a reversible installation"}},"content_sha256":"f82da43ba7ef9668f4c46b8412c68119bbaa68f532bc590d263e1e2892f685e3","contract_version":"catalog-lineage/v1","creator_id":"ap06-new-clone-creator","derived_from":[],"origin_instance_id":"ap06-new-plan-20260921-instance-v3","record_id":"P0014","revision":1,"source_identity":"production/auto-auto-plan-20260916t125851z-rev5#PL001","source_plans":[],"stage":"PLANNED","stage_evidence":[]}
