{"canonical_revision":1,"comparison":{"mechanism":{"source_locator":null,"value":null},"theme":{"source_locator":"metadata.yaml#title","value":"近いが届かない — Close but Cannot Reach"}},"content_sha256":"aabe64cd0bd506ffa4f79412c4b024bb258815fe641a5f19330d986be4a29ffa","contract_version":"catalog-lineage/v1","creator_id":"synthetic-provider-new-clone-creator","derived_from":[],"origin_instance_id":"synthetic-provider-new-clone-instance","record_id":"P0005","revision":1,"source_identity":"production/close-but-cannot-reach#PL001","source_plans":[],"stage":"PLANNED","stage_evidence":[]}
