{"canonical_revision":1,"comparison":{"mechanism":{"source_locator":null,"value":null},"theme":{"source_locator":"metadata.yaml#title","value":"backfill-gap-0010"}},"content_sha256":"dc073b4bb26599ab4449fbc2aab40a7cc576235f66a289b782c905896483836b","contract_version":"catalog-lineage/v1","creator_id":"ap06-new-clone-creator","derived_from":[],"origin_instance_id":"ap06-new-plan-20260921-instance-v3","record_id":"P0010","revision":1,"source_identity":"production/backfill-gap-0010#PL001","source_plans":[],"stage":"PLANNED","stage_evidence":[]}
