{"canonical_revision":1,"comparison":{"mechanism":{"source_locator":null,"value":null},"theme":{"source_locator":"metadata.yaml#title","value":"距離が境界を選ぶ — Distance Selects Boundary（旧P0006復旧版）"}},"content_sha256":"f0a1fe96b8283112975e19542ed7e67b8ed2e0772aadf5cff7b6bc059768fac3","contract_version":"catalog-lineage/v1","creator_id":"synthetic-provider-new-clone-creator","derived_from":[],"origin_instance_id":"synthetic-provider-new-clone-instance","record_id":"P0013","revision":1,"source_identity":"production/distance-selects-boundary#PL001","source_plans":[],"stage":"PLANNED","stage_evidence":[]}
