{"canonical_revision":1,"comparison":{"mechanism":{"source_locator":null,"value":null},"theme":{"source_locator":"metadata.yaml#title","value":"近くても受領されない — Near, Not Received（旧P0007復旧版）"}},"content_sha256":"c9ca519c9ac2cf351c1cf4aee02ed65cabb6ebd72ed49e84d3aae8bf77d6b872","contract_version":"catalog-lineage/v1","creator_id":"synthetic-provider-new-clone-creator","derived_from":[],"origin_instance_id":"synthetic-provider-new-clone-instance","record_id":"P0014","revision":1,"source_identity":"production/near-not-received#PL001","source_plans":[],"stage":"PLANNED","stage_evidence":[]}
