{"canonical_revision":1,"comparison":{"mechanism":{"source_locator":null,"value":null},"theme":{"source_locator":"metadata.yaml#title","value":"移動する空白 — Moving Gap（旧P0002復旧版）"}},"content_sha256":"92b1222ff99c32fc9f60b33e1a138e21a470b4611bc452120701c7705beb0d18","contract_version":"catalog-lineage/v1","creator_id":"synthetic-provider-new-clone-creator","derived_from":[],"origin_instance_id":"synthetic-provider-new-clone-instance","record_id":"P0010","revision":1,"source_identity":"production/moving-gap#PL001","source_plans":[],"stage":"PLANNED","stage_evidence":[]}
