{"canonical_revision":1,"comparison":{"mechanism":{"source_locator":null,"value":null},"theme":{"source_locator":"metadata.yaml#title","value":"aak07-agent-20260910-p4"}},"content_sha256":"aa4d7c8dcc33b40349f80d015b29830d4fc729434aba2000ae2245988e73be8e","contract_version":"catalog-lineage/v1","creator_id":"synthetic-provider-new-clone-creator","derived_from":[],"origin_instance_id":"synthetic-provider-new-clone-instance","record_id":"P0008","revision":1,"source_identity":"production/aak07-agent-20260910-p4#PL001","source_plans":[],"stage":"PLANNED","stage_evidence":[]}
