{"canonical_revision":1,"comparison":{"mechanism":{"source_locator":null,"value":null},"theme":{"source_locator":"metadata.yaml#title","value":"Receiving interval"}},"content_sha256":"b6279dfd84bd6c4108666bf4356d8754bd3d61311c801359386e30ee83f6fd31","contract_version":"catalog-lineage/v1","creator_id":"ap06-new-clone-creator","derived_from":[],"origin_instance_id":"ap06-new-plan-20260921-instance-v3","record_id":"P0011","revision":1,"source_identity":"production/backfill-gap-0011#PL001","source_plans":[],"stage":"PLANNED","stage_evidence":[]}
