{"canonical_revision":1,"comparison":{"mechanism":{"source_locator":null,"value":null},"theme":{"source_locator":"metadata.yaml#title","value":"Receiving interval"}},"content_sha256":"d86a0430f0cc7a314dbf8f76c8afd5b67ded2806ce16d679511f7eec84426b84","contract_version":"catalog-lineage/v1","creator_id":"ap06-new-clone-creator","derived_from":[],"origin_instance_id":"ap06-new-plan-20260921-instance-v3","record_id":"P0017","revision":1,"source_identity":"production/auto-auto-plan-20260921t152805z-rev1#PL001","source_plans":[],"stage":"PLANNED","stage_evidence":[]}
