{"canonical_revision":1,"comparison":{"mechanism":{"source_locator":null,"value":null},"theme":{"source_locator":"metadata.yaml#title","value":"Review threshold as a reversible installation"}},"content_sha256":"1bfd4ee043dd5cc07e6edb03ab77dafaa911b9bf4227a12634b1afce38cf78e9","contract_version":"catalog-lineage/v1","creator_id":"ap06-new-clone-creator","derived_from":[],"origin_instance_id":"ap06-new-clone-instance","record_id":"P0015","revision":1,"source_identity":"production/auto-auto-plan-20260916t125851z-rev6#PL001","source_plans":[],"stage":"PLANNED","stage_evidence":[]}
